{
  "$schema": "../schema.json",
  "id": "verification/knowledge-consistency-2026-08-02",
  "type": "review",
  "status": "pass",
  "date": "2026-08-02",
  "commit": "7844963",
  "summary": "Knowledge Consistency Gate run for Phase 1.5: links resolve, no duplication between knowledge and patterns, terminology unified via new glossary, rule/invariant split consistent.",
  "checks": [
    { "name": "internal-links", "result": "pass", "detail": "0 broken links across engineering/**/*.md" },
    { "name": "no-duplication", "result": "pass", "detail": "knowledge/security links to patterns; knowledge/fleet links to domain — no restating" },
    { "name": "terminology", "result": "pass", "detail": "platform/GLOSSARY.md added; capability/skill, tenant/company, playbook/runbook mapped" },
    { "name": "rule-vs-invariant", "result": "pass", "detail": "domain docs keep business-rules.md (intent) and invariants.md (hold-at-all-times) separate" },
    { "name": "adr-coherence", "result": "pass", "detail": "ADRs 0001-0005 all describe current design; none superseded" }
  ],
  "artifacts": [
    { "path": "engineering/platform/GLOSSARY.md", "kind": "report" }
  ]
}
