{
  "$schema": "../schema.json",
  "id": "traceability/vroom-rc1",
  "type": "review",
  "status": "pass",
  "date": "2026-08-02",
  "commit": "19a8d2f",
  "summary": "Business Traceability Gate run for Vroom RC1: every business rule traced through Rule → Invariant → Code → Test → Evidence. Chain structure present for all represented rules; 12 gaps owned and tracked in Phase 2 (roadmap). No silent breaks.",
  "checks": [
    { "name": "rule-to-invariant", "result": "pass", "detail": "All documented rules map to numbered invariants or open policy items" },
    { "name": "invariant-to-code", "result": "pass", "detail": "Every invariant names its enforcement" },
    { "name": "invariant-to-test", "result": "pass", "detail": "Every invariant has a test-matrix row (some 'needed')" },
    { "name": "gaps-owned", "result": "pass", "detail": "12 gaps recorded with owners in platform/ROADMAP.md Phase 2" }
  ],
  "artifacts": [
    { "path": "engineering/verification/traceability/vroom-rc1.md", "kind": "report" }
  ],
  "notes": "Full test closure (all invariants green) is the Phase 2D deliverable. Gate passes 1.5 because the chain structure exists and no break is silent."
}
